,tweet_id,timestamp,text,rating_numerator,rating_denominator,name,characteristic
3664,678396796259975168,2015-12-20,These little fellas have opposite facial expressions. Both 12/10,12,10,,Not Specified
3665,678389028614488064,2015-12-20,"This is Bella. She just learned that her final grade in chem was a 92.49 
poor pupper 11/10",11,10,Bella,Not Specified
3666,678380236862578688,2015-12-20,This is Crumpet. He underestimated the snow. Quickly retreating. 10/10,10,10,Crumpet,Not Specified
3667,678341075375947776,2015-12-19,This pupper likes tape. 12/10,12,10,,Not Specified
3668,678334497360859136,2015-12-19,This is Rosie. She has a snazzy bow tie and a fin for a tail. Probably super fast underwater. Cool socks 10/10,10,10,Rosie,Not Specified
3669,678278586130948096,2015-12-19,Another spooky pupper here. Most definitely floating. No legs. Probably knows some dark magic. 10/10 very spooked,10,10,,Not Specified
3670,678255464182861824,2015-12-19,This is Jessifer. She is a Bismoth Teriyaki. Flowers being attacked by hurricanes on bandana (rad). 9/10 stellar pup,9,10,Jessifer,Not Specified
3671,678021115718029313,2015-12-19,This is Reese. He likes holding hands. 12/10,12,10,Reese,Not Specified
3672,677961670166224897,2015-12-18,This is Izzy. She's showing off the dance moves she's been working on. 11/10 I guess hard work pays off,11,10,Izzy,Not Specified
3673,677918531514703872,2015-12-18,"""Everything looks pretty good in there. Make sure to brush your gums. Been flossing? How's school going?"" Both 10/10",10,10,,Not Specified
3674,677895101218201600,2015-12-18,Guys this was terrifying. Really spooked me up. We don't rate ghosts. We rate dogs. Please only send dogs... 9/10,9,10,,Not Specified
3675,677716515794329600,2015-12-18,IT'S PUPPERGEDDON. Total of 144/120 ...I think,144,120,,Not Specified
3676,677700003327029250,2015-12-18,This is Ralph. He's an interpretive dancer. 10/10,10,10,Ralph,Not Specified
3677,677698403548192770,2015-12-18,This is Sadie. She got her holidays confused. 9/10 damn it Sadie,9,10,Sadie,Not Specified
3678,677687604918272002,2015-12-18,This was Cindy's face when she heard Susan forgot the snacks for after the kid's soccer game. 11/10,11,10,,Not Specified
3679,677673981332312066,2015-12-18,Endangered triangular pup here. Could be a wizard. Caught mid-laugh. No legs. Just fluff. Probably a wizard. 9/10,9,10,,Not Specified
3680,677662372920729601,2015-12-18,"In honor of the new Star Wars movie. Here's Yoda pug. 12/10 pet really well, would I",12,10,,Not Specified
3681,677644091929329666,2015-12-18,This is a dog swinging. I really enjoyed it so I hope you all do as well. 11/10,11,10,,Not Specified
3682,677573743309385728,2015-12-17,This is Sandy. He's sexually confused. Thinks he's a pigeon. Also an All-American cheese catcher. 10/10 so petable,10,10,Sandy,Not Specified
3683,677565715327688705,2015-12-17,Contortionist pup here. Inside pentagram. Clearly worships Satan. Known to slowly push fragile stuff off tables 6/10,6,10,,Not Specified
3684,677557565589463040,2015-12-17,Reckless pupper here. Not even looking at road. Absolute menace. No regard for fellow pupper lives. 10/10 still cute,10,10,,Not Specified
3685,677547928504967168,2015-12-17,Not much to say here. I just think everyone needs to see this. 12/10,12,10,,Not Specified
3686,677530072887205888,2015-12-17,Say hello to Axel. He's a Black Chevy Pinot on wheels. 0 to 60 in 5.7 seconds (if downhill). 9/10 I call shotgun,9,10,Axel,Not Specified
3687,677335745548390400,2015-12-17,Downright inspiring 12/10,12,10,,Not Specified
3688,677334615166730240,2015-12-17,This dog gave up mid jump. 9/10,9,10,,Not Specified
3689,677331501395156992,2015-12-17,Meet Humphrey. He's a Northern Polyp Viagra. One ear works. Face stuck like that. Always surprised. 9/10 petable af,9,10,Humphrey,Not Specified
3690,677328882937298944,2015-12-17,This is Derek. All the dogs adore Derek. He's a great guy. 10/10 really solid pup,10,10,Derek,Not Specified
3691,677314812125323265,2015-12-17,"Meet Tassy &amp; Bee. Tassy is pretty chill, but Bee is convinced the Ruffles are haunted. 10/10 &amp; 11/10 respectively",10,10,Tassy,Not Specified
3692,677301033169788928,2015-12-17,This is Juckson. He's totally on his way to a nascar race. 5/10 for Juckson,5,10,Juckson,Not Specified
3693,677269281705472000,2015-12-16,This is the happiest pupper I've ever seen. 10/10 would trade lives with,10,10,,Not Specified
3694,677228873407442944,2015-12-16,Say hello to Chuq. He just wants to fit in. 11/10,11,10,Chuq,Not Specified
3695,677187300187611136,2015-12-16,Here we see a Byzantine Rigatoni. Very aerodynamic. No eyes. Actually not windy here they just look like that. 9/10,9,10,,Not Specified
3696,676975532580409345,2015-12-16,This is Cooper. He doesn't know how cheese works. Likes the way it feels on his face. Cheeky tongue slip. 11/10,11,10,Cooper,Not Specified
3697,676957860086095872,2015-12-16,10/10 I'd follow this dog into battle no questions asked,10,10,,Not Specified
3698,676949632774234114,2015-12-16,This is Tyrus. He's a Speckled Centennial Ticonderoga. Terrified of floating red ball. Nifty bandana. 8/10 v petable,8,10,Tyrus,Not Specified
3699,676948236477857792,2015-12-16,This is Karl. Karl thinks he's slick. 6/10 sneaky pup,6,10,Karl,Not Specified
3700,676946864479084545,2015-12-16,This pups goal was to get all four feet as close to each other as possible. Valiant effort 12/10,12,10,,Not Specified
3701,676942428000112642,2015-12-16,Who leaves the last cupcake just sitting there? 9/10,9,10,,Not Specified
3702,676936541936185344,2015-12-16,Here we see a rare pouched pupper. Ample storage space. Looks alert. Jumps at random. Kicked open that door. 8/10,8,10,,Not Specified
3703,676916996760600576,2015-12-16,Super speedy pupper. Does not go gentle into that goodnight. 10/10,10,10,,Not Specified
3704,676897532954456065,2015-12-15,Exotic handheld dog here. Appears unathletic. Feet look deadly. Can be thrown a great distance. 5/10 might pet idk,5,10,,Not Specified
3705,676864501615042560,2015-12-15,Meet Ash. He's just a head now. Lost his body during the Third Crusade. Still in good spirits. 10/10 would pet well,10,10,Ash,Not Specified
3706,676821958043033607,2015-12-15,Finally some constructive political change in this country. 11/10,11,10,,Not Specified
3707,676819651066732545,2015-12-15,Watch out Airbud. This pupper is also good at the sports. 12/10 I'm thinking D1,12,10,,Not Specified
3708,676811746707918848,2015-12-15,Say hello to Penny &amp; Gizmo. They are practicing their caroling. The ambition in the room is tangible. 9/10 for both,9,10,Penny,Not Specified
3709,676776431406465024,2015-12-15,"When someone yells ""cops!"" at a party and you gotta get your drunk friend out of there. 10/10",10,10,,Not Specified
3710,676617503762681856,2015-12-15,I promise this wasn't meant to be a cuteness overload account but ermergerd look at this cozy pupper. 13/10,13,10,,Not Specified
3711,676613908052996102,2015-12-15,This is the saddest/sweetest/best picture I've been sent. 12/10 ðŸ˜¢ðŸ¶,12,10,,Not Specified
3712,676606785097199616,2015-12-15,*screeches for a sec and then faints* 12/10,12,10,,Not Specified
3713,676603393314578432,2015-12-15,This is Godzilla pupper. He had a ruff childhood &amp; now deflects that pain outward by terrorizing cities. Tragic 9/10,9,10,Godzilla,Not Specified
3714,676593408224403456,2015-12-15,This pupper loves leaves. 11/10 for committed leaf lover,11,10,,Not Specified
3715,676588346097852417,2015-12-15,This is Bubbles. He kinda resembles a fish. Always makes eye contact with u no matter what. Sneaky tongue slip. 5/10,5,10,Bubbles,Not Specified
3716,676582956622721024,2015-12-15,"Meet Vinnie. He's having fun while being safe. Well not a lot of fun, but definitely safe, and that's important 8/10",8,10,Vinnie,Not Specified
3717,676575501977128964,2015-12-15,This pupper is very passionate about Christmas. Wanted to give the tree a hug. So cute. 8/10,8,10,,Not Specified
3718,676533798876651520,2015-12-14,ITSOFLUFFAYYYYY 12/10,12,10,,Not Specified
3719,676496375194980353,2015-12-14,Say hello to Griffin. He's upset because his costume for Halloween didn't arrive until today. 9/10 cheer up pup,9,10,Griffin,Not Specified
3720,676470639084101634,2015-12-14,Three generations of pupper. 11/10 for all,11,10,,Not Specified
3721,676440007570247681,2015-12-14,Hope your Monday isn't too awful. Here's two baseball puppers. 11/10 for each,11,10,,Not Specified
3722,676430933382295552,2015-12-14,"Meet Duke. He's an Urban Parmesan. They know he's scared of the green rubber dog. ""Why u do dis?"" thinks Duke. 10/10",10,10,Duke,Not Specified
3723,676263575653122048,2015-12-14,All this pupper wanted to do was go skiing. No one told him about the El NiÃ±o. Poor pupper. 10/10 maybe next year,10,10,,Not Specified
3724,676237365392908289,2015-12-14,Say hello to Winston. He has no respect for the system. Much rebellion. I think that's a palm tree... nice. 8/10,8,10,Winston,Not Specified
3725,676219687039057920,2015-12-14,This is Kenneth. He's stuck in a bubble. 10/10 hang in there Kenneth,10,10,Kenneth,Not Specified
3726,676215927814406144,2015-12-14,This is Herm. He just wants to be like the other dogs. Sneaky tongue slip. Super fuzzy. 9/10 would cuddle firmly,9,10,Herm,Not Specified
3727,676191832485810177,2015-12-14,These two pups just met and have instantly bonded. Spectacular scene. Mesmerizing af. 10/10 and 7/10 for blue dog,10,10,,Not Specified
3728,676146341966438401,2015-12-13,This is Bert. He likes flowers. 10/10,10,10,Bert,Not Specified
3729,676121918416756736,2015-12-13,Here we are witnessing a very excited dog. Clearly has no control over neck movements. 8/10 would still pet,8,10,,Not Specified
3730,676101918813499392,2015-12-13,Meet Striker. He's ready for Christmas. 11/10,11,10,Striker,Not Specified
3731,676098748976615425,2015-12-13,Extremely rare pup here. Very religious. Always praying. Too many legs. Not overwhelmingly fluffy. Won't bark. 3/10,3,10,,Not Specified
3732,676089483918516224,2015-12-13,"""Yes hello I'ma just snag this here toasted bagel real quick. carry on."" 9/10",9,10,,Not Specified
3733,675898130735476737,2015-12-13,I'm sure you've all seen this pupper. Not prepared at all for the flying disc of terror. 10/10,10,10,,Not Specified
3734,675891555769696257,2015-12-13,This is Donny. He's summoning the demon monster Babadook. 6/10 Donny please no that won't be a good time for anyone,6,10,Donny,Not Specified
3735,675888385639251968,2015-12-13,Breathtaking scene. A father taking care of his newborn pup. Tugs at the heartstrings. 10/10 restores my faith,10,10,,Not Specified
3736,675878199931371520,2015-12-13,"Ok, I'll admit this is a pretty adorable bunny hopping towards the ocean but please only send in dogs... 11/10",11,10,,Not Specified
3737,675870721063669760,2015-12-13,&amp; this is Yoshi. Another world record contender 11/10 (what the hell is happening why are there so many contenders?),11,10,,Not Specified
3738,675853064436391936,2015-12-13,Here we have an entire platoon of puppers. Total score: 88/80 would pet all at once,88,80,,Not Specified
3739,675845657354215424,2015-12-13,"This is Pepper. She's not fully comfortable riding her imaginary bike yet. 10/10 don't worry pupper, it gets easier",10,10,Pepper,Not Specified
3740,675822767435051008,2015-12-12,ðŸŽ¶ HELLO FROM THE OTHER SIIIIIIIIDE ðŸŽ¶ 10/10s,10,10,,Not Specified
3741,675820929667219457,2015-12-12,Here's a handful of sleepy puppers. All look unaware of their surroundings. Lousy guard dogs. Still cute tho 11/10s,11,10,,Not Specified
3742,675798442703122432,2015-12-12,This is Bernie. He just touched a boob for the first time. 10/10,10,10,Bernie,Not Specified
3743,675781562965868544,2015-12-12,Say hello to Buddah. He was Waldo for Halloween. 11/10,11,10,Buddah,Not Specified
3744,675740360753160193,2015-12-12,Here's a pupper licking in slow motion. 12/10 please enjoy,12,10,,Not Specified
3745,675710890956750848,2015-12-12,This is Lenny. He was just told that he couldn't explore the fish tank. 12/10 smh all that work for nothing,12,10,Lenny,Not Specified
3746,675707330206547968,2015-12-12,We've got ourselves a battle here. Watch out Reggie. 11/10,11,10,,Not Specified
3747,675706639471788032,2015-12-12,This is a Sizzlin Menorah spaniel from Brooklyn named Wylie. Lovable eyes. Chiller as hell. 10/10 and I'm out.. poof,10,10,,Not Specified
3748,675534494439489536,2015-12-12,Seriously guys?! Only send in dogs. I only rate dogs. This is a baby black bear... 11/10,11,10,,Not Specified
3749,675531475945709568,2015-12-12,This is Ellie AKA Queen Slayer of the Orbs. Very self-motivated. Great yard. Rad foliage. 10/10 would pet diligently,10,10,Ellie,Not Specified
3750,675522403582218240,2015-12-12,Meet Sammy. He's a Motorola Firefox. Hat under hoodie (must be a half-decent up and coming white rapper) 10/10,10,10,Sammy,Not Specified
3751,675517828909424640,2015-12-12,12/10 stay woke,12,10,,Not Specified
3752,675501075957489664,2015-12-12,"I shall call him squishy and he shall be mine, and he shall be my squishy. 13/10",13,10,,Not Specified
3753,675497103322386432,2015-12-12,Meet Reggie. He's going for the world record. Must concentrate. Focus up pup. 11/10 we all believe in you Reggie,11,10,Reggie,Not Specified
3754,675489971617296384,2015-12-12,RT until we find this dog. Clearly a cool dog (front leg relaxed out window). Looks to be a superb driver. 10/10,10,10,,Not Specified
3755,675483430902214656,2015-12-12,Rare shielded battle dog here. Very happy about abundance of lettuce. Painfully slow fetcher. Still petable. 5/10,5,10,,Not Specified
3756,675432746517426176,2015-12-11,Happy Friday. Here's some golden puppers. 12/10 for all,12,10,,Not Specified
3757,675372240448454658,2015-12-11,"The tail alone is 13/10. Great dog, better owner",13,10,,Not Specified
3758,675362609739206656,2015-12-11,This is Daisy. She loves that shoe. Still no seat belt. Super churlish. 12/10 the dogs are killing it today,12,10,Daisy,Not Specified
3759,675354435921575936,2015-12-11,Everyone needs to watch this. 13/10,13,10,,Not Specified
3760,675349384339542016,2015-12-11,Yea I lied. Here's more. All 13/10,13,10,,Not Specified
3761,675334060156301312,2015-12-11,Good morning here's a grass pupper. 12/10,12,10,,Not Specified
3762,675166823650848770,2015-12-11,This is Arnold. He broke his leg saving a handicapped child from a forest fire. True hero. 10/10 inspirational dog,10,10,Arnold,Not Specified
3763,675153376133427200,2015-12-11,What kind of person sends in a picture without a dog in it? 1/10 just because that's a nice table,1,10,,Not Specified
3764,675149409102012420,2015-12-11,holy shit 12/10,12,10,,Not Specified
3765,675147105808306176,2015-12-11,When you're presenting a group project and the 4th guy tells the teacher that he did all the work. 10/10,10,10,,Not Specified
3766,675146535592706048,2015-12-11,This is Coops. He's yelling at the carpet. Not very productive Coops. 7/10,7,10,Coops,Not Specified
3767,675145476954566656,2015-12-11,What an honor. 3 dogs here. Blond one is clearly a gymnast. Other two just confused. Very nifty pups. 9/10 for all,9,10,,Not Specified
3768,675135153782571009,2015-12-11,This is Steven. He got locked outside. Damn it Steven. 5/10 nice grill tho,5,10,Steven,Not Specified
3769,675113801096802304,2015-12-11,Meet Zuzu. He just graduated college. Astute pupper. Needs 2 leashes to contain him. Wasn't ready for the pic. 10/10,10,10,Zuzu,Not Specified
3770,675111688094527488,2015-12-11,Say hello to Oliver. He thought what was inside the pillow should be outside the pillow. Blurry since birth. 8/10,8,10,Oliver,Not Specified
3771,675109292475830276,2015-12-11,C'mon guys. We've been over this. We only rate dogs. This is a cow. Please only submit dogs. Thank you...... 9/10,9,10,,Not Specified
3772,675047298674663426,2015-12-10,This is a fluffy albino Bacardi Columbia mix. Excellent at the tweets. 11/10 would hug gently,11,10,,Not Specified
3773,675015141583413248,2015-12-10,Meet Moe. He's a golden Fetty Woof. Doesn't respect the authorities. Might own a motorhome? 10/10 revolutionary pup,10,10,Moe,Not Specified
3774,675006312288268288,2015-12-10,Say hello to Mollie. This pic was taken after she bet all her toys on Ronda Rousey. 10/10 hang in there pupper,10,10,Mollie,Not Specified
3775,675003128568291329,2015-12-10,Meet Laela. She's adorable. Magnificent eyes. But I don't see a seat belt. Insubordinate.. and churlish. Still 12/10,12,10,Laela,Not Specified
3776,674999807681908736,2015-12-10,Ok last one of these. I may try to make some myself. Anyway here ya go. 13/10,13,10,,Not Specified
3777,674805413498527744,2015-12-10,"When your entire life is crumbling before you and you're trying really hard to hold your shit together.
10/10",10,10,,Not Specified
3778,674800520222154752,2015-12-10,This is Tedders. He broke his leg saving babies from the Pompeii eruption. 11/10 where's his Purple Heart? @POTUS,11,10,Tedders,Not Specified
3779,674793399141146624,2015-12-10,I have found another. 13/10,13,10,,Not Specified
3780,674790488185167872,2015-12-10,ER... MER... GERD 13/10,13,10,,Not Specified
3781,674788554665512960,2015-12-10,Say hello to Maggie. She's a Western Septic Downy. Pretends to be Mexican. Great hardwood flooring. 9/10,9,10,Maggie,Not Specified
3782,674781762103414784,2015-12-10,Bedazzled pup here. Fashionable af. Super yellow. Looks hella fluffy. Webbed paws for efficient fetching. 8/10,8,10,,Not Specified
3783,674774481756377088,2015-12-10,This is Superpup. His head isn't proportional to his body. Has yet to serve any justice. 11/10 maybe one day pupper,11,10,Superpup,Not Specified
3784,674767892831932416,2015-12-10,This pup was carefully tossed to make it look like she's riding that horse. I have no words this is fabulous. 12/10,12,10,,Not Specified
3785,674764817387900928,2015-12-10,These two pups are masters of camouflage. Very dedicated to the craft. Both must've spent decades practicing. 10/10s,10,10,,Not Specified
3786,674754018082705410,2015-12-10,Just received another perfect photo of dogs and the sunset. 12/10,12,10,,Not Specified
3787,674752233200820224,2015-12-10,Everyone please just appreciate how perfect these two photos are. 12/10 for both,12,10,,Not Specified
3788,674743008475090944,2015-12-10,This is Sophie. She just saw a spider. 10/10 don't just stand there Sophie,10,10,Sophie,Not Specified
3789,674739953134403584,2015-12-09,"""ðŸŽ¶ DO YOU BELIEVE IN LIFE AFTER LOVE ðŸŽ¶""
11/10",11,10,,Not Specified
3790,674737130913071104,2015-12-09,Meet Rufio. He is unaware of the pink legless pupper wrapped around him. Might want to get that checked 10/10 &amp; 4/10,10,10,Rufio,Not Specified
3791,674690135443775488,2015-12-09,Meet Patrick. He's an exotic pup. Jumps great distances for a dog. Always gets injured when I toss him a ball. 3/10,3,10,Patrick,Not Specified
3792,674670581682434048,2015-12-09,Meet Jeb &amp; Bush. Jeb is somehow stuck in that fence and Bush won't stop whispering sweet nothings in his ear. 9/10s,9,10,Jeb,Not Specified
3793,674664755118911488,2015-12-09,This is Rodman. He's getting destroyed by the surfs. Valiant effort though. 10/10 better than most puppers probably,10,10,Rodman,Not Specified
3794,674646392044941312,2015-12-09,Two gorgeous dogs here. Little waddling dog is a rebel. Refuses to look at camera. Must be a preteen. 5/10 &amp; 8/10,5,10,,Not Specified
3795,674644256330530816,2015-12-09,When you see sophomores in high school driving. 11/10,11,10,,Not Specified
3796,674638615994089473,2015-12-09,This pupper is fed up with being tickled. 12/10 I'm currently working on an elaborate heist to steal this dog,12,10,,Not Specified
3797,674632714662858753,2015-12-09,Rare submerged pup here. Holds breath for a long time. Frowning because that spoon ignores him. 5/10 would still pet,5,10,,Not Specified
3798,674468880899788800,2015-12-09,This is Louis. He thinks he's flying. 13/10 this is a legendary pup,13,10,Louis,Not Specified
3799,674447403907457024,2015-12-09,This pupper just wants a belly rub. This pupper has nothing to do w the tree being sideways now. 10/10 good pupper,10,10,,Not Specified
3800,674436901579923456,2015-12-09,Meet Bailey. She plays with her food. Very childish. Doesn't even need a battle helmet smh. Still cute though. 9/10,9,10,Bailey,Not Specified
3801,674422304705744896,2015-12-09,This is Ava. She doesn't understand flowers. 12/10 would caress firmly,12,10,Ava,Not Specified
3802,674416750885273600,2015-12-09,This is Jonah. He's a Stinted Fisher Price. Enjoys chewing on his miniature RipStik. 10/10 very upbeat fellow,10,10,Jonah,Not Specified
3803,674410619106390016,2015-12-09,This is Lenny. He wants to be a sprinkler. 10/10 you got this Lenny,10,10,Lenny,Not Specified
3804,674394782723014656,2015-12-09,This is Gary. He's a hide and seek champion. Second only to Kony. 8/10 Gary has a gift,8,10,Gary,Not Specified
3805,674372068062928900,2015-12-08,Meet Chesney. On the outside he stays calm &amp; collected. On the inside he's having a complete mental breakdown. 10/10,10,10,Chesney,Not Specified
3806,674318007229923329,2015-12-08,This is Lennon. He's in quite the predicament. 8/10 hang in there pupper,8,10,Lennon,Not Specified
3807,674307341513269249,2015-12-08,This is life-changing. 12/10,12,10,,Not Specified
3808,674291837063053312,2015-12-08,This is Kenny. He just wants to be included in the happenings. 11/10,11,10,Kenny,Not Specified
3809,674271431610523648,2015-12-08,"""AT DAWN, WE RIDE""
10/10 for both dogs",10,10,,Not Specified
3810,674269164442398721,2015-12-08,"This is Bob. He's a Juniper Fitzsimmons. His body is 2, but his face is 85. Always looks miserable. Nice stool. 8/10",8,10,Bob,Not Specified
3811,674265582246694913,2015-12-08,This is Henry. He's a shit dog. Short pointy ears. Leaves trail of pee. Not fluffy. Doesn't come when called. 2/10,2,10,Henry,Not Specified
3812,674262580978937856,2015-12-08,This is Gus. He's super stoked about being an elephant. Couldn't be happier. 9/10 for elephant pupper,9,10,Gus,Not Specified
3813,674255168825880576,2015-12-08,Say hello to Bobbay. He's a marshmallow wizard. 10/10,10,10,Bobbay,Not Specified
3814,674082852460433408,2015-12-08,This is a Sagitariot Baklava mix. Loves her new hat. 11/10 radiant pup,11,10,,Not Specified
3815,674075285688614912,2015-12-08,Say hello to Mitch. He thinks that's a hat. Nobody has told him yet. 11/10 please no one tell him,11,10,Mitch,Not Specified
3816,674063288070742018,2015-12-08,This is Earl. Earl is lost. Someone help Earl. He has no tags. Just trying to get home. 5/10 hang in there Earl,5,10,Earl,Not Specified
3817,674053186244734976,2015-12-08,"This is Stanley. Yes he is aware of the spoon's presence, he just doesn't know what he should do about it. 10/10",10,10,Stanley,Not Specified
3818,674051556661161984,2015-12-08,This is Lucy. She knits. Specializes in toboggans. 10/10 I'd buy a toboggan from Lucy,10,10,Lucy,Not Specified
3819,674045139690631169,2015-12-08,Herd of wild dogs here. Not sure what they're trying to do. No real goals in life. 3/10 find your purpose puppers,3,10,,Not Specified
3820,674042553264685056,2015-12-08,Yea I can't handle the cuteness anymore. Curls for days. 12/10 for all,12,10,,Not Specified
3821,674038233588723717,2015-12-08,This is Kaiya. She's an aspiring shoe model. 12/10 follow your dreams pupper,12,10,Kaiya,Not Specified
3822,674036086168010753,2015-12-08,Meet Daisy. She has no eyes &amp; her face has been blurry since birth. Quite the trooper tho. Still havin a blast. 9/10,9,10,Daisy,Not Specified
3823,674024893172875264,2015-12-08,When you realize it doesn't matter how hard you study. You're still going to fail. 10/10,10,10,,Not Specified
3824,674019345211760640,2015-12-08,This is Acro. You briefly see her out of the corner of your eye. You look and she's not there. 10/10 mysterious pup,10,10,Acro,Not Specified
3825,674014384960745472,2015-12-07,Say hello to Aiden. His eyes are magical. Loves his little Guy Fieri friend. Sneaky tongue slip. 11/10 would caress,11,10,Aiden,Not Specified
3826,674008982932058114,2015-12-07,This pup is sad bc he didn't get to be the toy car. Also he has shitty money management skills. 10/10 still cute tho,10,10,,Not Specified
3827,673956914389192708,2015-12-07,This is one esteemed pupper. Just graduated college. 10/10 what a champ,10,10,,Not Specified
3828,673919437611909120,2015-12-07,This is Obie. He is on guard watching for evildoers from the comfort of his pumpkin. Very brave pupper. 11/10,11,10,Obie,Not Specified
3829,673906403526995968,2015-12-07,Guys I'm getting real tired of this. We only rate dogs. Please don't send in other things like this Bulbasaur. 3/10,3,10,,Not Specified
3830,673887867907739649,2015-12-07,When you're having a great time sleeping and your mom comes in and turns on the lights. 10/10,10,10,,Not Specified
3831,673715861853720576,2015-12-07,This is a heavily opinionated dog. Loves walls. Nobody knows how the hair works. Always ready for a kiss. 4/10,4,10,,Not Specified
3832,673711475735838725,2015-12-07,ðŸŽ¶ HELLO FROM THE OTHER SIIIIIIIIDE ðŸŽ¶ 10/10,10,10,,Not Specified
3833,673709992831262724,2015-12-07,I know a lot of you are studying for finals. Good luck! Here's this. It should help somehow. 12/10,12,10,,Not Specified
3834,673708611235921920,2015-12-07,This is Riley. She's just an adorable football fan. 12/10 I'd watch the sports with her,12,10,Riley,Not Specified
3835,673707060090052608,2015-12-07,This is Raymond. He's absolutely terrified of floating tennis ball. 10/10 it'll be ok pupper,10,10,Raymond,Not Specified
3836,673705679337693185,2015-12-07,This is Dot. He found out you only pretended to throw the ball that one time. You don't fuck with Dot. 8/10,8,10,Dot,Not Specified
3837,673700254269775872,2015-12-07,Large blue dog here. Cool shades. Flipping us off w both hands. Obviously a preteen. 3/10 for rude blue preteen pup,3,10,,Not Specified
