,tweet_id,timestamp,text,rating_numerator,rating_denominator,name,characteristic
2656,786286427768250368,2016-10-12,This is Arnie. He's afraid of his own bark. 12/10 would comfort,12,10,Arnie,Not Specified
2657,786233965241827333,2016-10-12,This is Mattie. She's extremely dangerous. Will bite your h*ckin finger right off. Still 11/10 would pet with caution,11,10,Mattie,Not Specified
2658,785927819176054784,2016-10-11,This is Lucy. She's strives to be the best potato she can be. 12/10 would boop,12,10,Lucy,Not Specified
2659,785872687017132033,2016-10-11,Meet Rusty. He appears to be rather h*ckin fluffy. Also downright adorable af. 12/10 would rub my face against his,12,10,Rusty,Not Specified
2660,785639753186217984,2016-10-11,This is Pinot. He's a sophisticated doggo. You can tell by the hat. Also pointier than your average pupper. Still 10/10 would pet cautiously,10,10,Pinot,Not Specified
2661,785533386513321988,2016-10-10,This is Dallas. Her tongue is ridiculous. 11/10 h*ckin proud af,11,10,Dallas,Not Specified
2662,785515384317313025,2016-10-10,"Today, 10/10, should b",10,10,,Not Specified
2663,785264754247995392,2016-10-09,This is Doc. He requested to be carried around like that. 12/10 anything for Doc,12,10,Doc,Not Specified
2664,785170936622350336,2016-10-09,This is Hero. He was enjoying the car ride until he remembered that bees are dying globally at an alarming rate. 11/10,11,10,Hero,Not Specified
2665,784826020293709826,2016-10-08,This is Rusty. He's going D1 for sure. Insane vertical. 13/10 would draft,13,10,Rusty,Not Specified
2666,784517518371221505,2016-10-07,This is Frankie. He has yet to learn how to control his tongue. 11/10 maybe one day,11,10,Frankie,Not Specified
2667,784431430411685888,2016-10-07,This is Stormy. He's curly af. Already pupared for Coachella next year. 12/10,12,10,Stormy,Not Specified
2668,784183165795655680,2016-10-07,This is Reginald. He's one magical puppo. Aerodynamic af. 12/10 would catch,12,10,Reginald,Not Specified
2669,784057939640352768,2016-10-06,This is Balto. He's very content. Legendary tongue slippage. 12/10 would pet forever,12,10,Balto,Not Specified
2670,783839966405230592,2016-10-06,This is Riley. His owner put a donut pillow around him and he loves it so much he won't let anyone take it off. 13/10,13,10,Riley,Not Specified
2671,783821107061198850,2016-10-06,This is Mairi. She has mastered the art of camouflage. 12/10 h*ckin sneaky af,12,10,Mairi,Not Specified
2672,783695101801398276,2016-10-05,This is Loomis. He's the leader of the Kenneth search party. The passion is almost overwhelming. 12/10 one day he will be free,12,10,Loomis,Not Specified
2673,783466772167098368,2016-10-05,This is Finn. He likes eavesdropping from filing cabinets. It's a real issue but no one has approached him about it. 11/10 would still pet,11,10,Finn,Not Specified
2674,783391753726550016,2016-10-04,Meet Godi. He's an avid beachgoer and part time rainbow summoner. Eyeliner flawless af. 13/10 would snug well,13,10,Godi,Not Specified
2675,783334639985389568,2016-10-04,This is Dave. He's currently in a predicament. Doesn't seem to mind tho. 12/10 someone assist Dave,12,10,Dave,Not Specified
2676,783085703974514689,2016-10-03,This is Earl. He can't catch. Did his best tho. 11/10 would repair confidence with extra pats,11,10,Earl,Not Specified
2677,782969140009107456,2016-10-03,This is Cali. She arrived preassembled. Convenient af. 12/10 appears to be rather h*ckin pettable,12,10,Cali,Not Specified
2678,782747134529531904,2016-10-03,This is Deacon. He's the happiest almost dry doggo I've ever seen. 11/10 would smile back,11,10,Deacon,Not Specified
2679,782722598790725632,2016-10-02,"This is Penny. She fought a bee and the bee won. 10/10 you're fine Penny, everything's fine",10,10,Penny,Not Specified
2680,782598640137187329,2016-10-02,This is Timmy. He's quite large. According to a trusted source it's actually a dog wearing a dog suit. 11/10,11,10,Timmy,Not Specified
2681,782305867769217024,2016-10-01,This is Sampson. He just graduated. Ready to be a doggo now. Time for the real world. 12/10 have fun with taxes,12,10,Sampson,Not Specified
2682,781955203444699136,2016-09-30,This is Chipson. He weighed in at .3 ounces and is officially super h*ckin smol. Space-saving af. 11/10 would snug delicately,11,10,Chipson,Not Specified
2683,781661882474196992,2016-09-30,Who keeps sending in pictures without dogs in them? This needs to stop. 5/10 for the mediocre road,5,10,,Not Specified
2684,781655249211752448,2016-09-30,This is Combo. The daily struggles of being a doggo have finally caught up with him. 11/10,11,10,Combo,Not Specified
2685,781524693396357120,2016-09-29,Idk why this keeps happening. We only rate dogs. Not Bangladeshi Couch Chipmunks. Please only send dogs... 12/10,12,10,,Not Specified
2686,781308096455073793,2016-09-29,"Pupper butt 1, Doggo 0. Both 12/10",12,10,,Not Specified
2687,781251288990355457,2016-09-28,This is Oakley. He just got yelled at for going 46 in a 45. Churlish af. 11/10 would still pet so well,11,10,Oakley,Not Specified
2688,781163403222056960,2016-09-28,"We normally don't rate lobsters, but this one appears to be a really good lobster. 10/10 would pet with caution",10,10,,Not Specified
2689,780931614150983680,2016-09-28,I want to finally rate this iconic puppo who thinks the parade is all for him. 13/10 would absolutely attend,13,10,,Not Specified
2690,780858289093574656,2016-09-27,"This is Dash. He's very stylish, but also incredibly unimpressed with the current state of our nation. 10/10 would pet ears first",10,10,Dash,Not Specified
2691,780800785462489090,2016-09-27,This is Koda. He has a weird relationship with tall grass. Slightly concerning. 11/10 would def still pet,11,10,Koda,Not Specified
2692,780601303617732608,2016-09-27,Meet Hercules. He can have whatever he wants for the rest of eternity. 12/10 would snug passionately,12,10,Hercules,Not Specified
2693,780543529827336192,2016-09-26,Here's a perturbed super floof. 12/10 would snug so damn well,12,10,,Not Specified
2694,780459368902959104,2016-09-26,"This is Bear. Don't worry, he's not a real bear tho. Contains unreal amounts of squish. 11/10 heteroskedastic af",11,10,Bear,Not Specified
2695,780192070812196864,2016-09-25,We only rate dogs. Pls stop sending in non-canines like this Urban Floof Giraffe. I can't handle this. 11/10,11,10,,Not Specified
2696,780074436359819264,2016-09-25,Here's a doggo questioning his entire existence. 10/10 someone tell him he's a good boy ,10,10,,Not Specified
2697,779834332596887552,2016-09-25,This is Scout. He really wants to kiss himself. H*ckin inappropriate. 11/10 narcissistic af,11,10,Scout,Not Specified
2698,779377524342161408,2016-09-23,Have you ever seen such a smol pupper? Portable af. 12/10 would keep in shirt pocket,12,10,,Not Specified
2699,779123168116150273,2016-09-23,This is Reggie. He hugs everyone he meets. 12/10 keep spreading the love Reggie,12,10,Reggie,Not Specified
2700,779056095788752897,2016-09-22,Everybody drop what you're doing and look at this dog. 13/10 must be super h*ckin rare,13,10,,Not Specified
2701,778990705243029504,2016-09-22,This is Jay. He's really h*ckin happy about the start of fall. Sneaky tongue slip in 2nd pic. 11/10 snuggly af,11,10,Jay,Not Specified
2702,778764940568104960,2016-09-22,Oh my god it's Narcos but Barkos. 13/10 someone please make this happen,13,10,,Not Specified
2703,778748913645780993,2016-09-22,"This is Mya (pronounced ""mmmyah?""). Her head is round af. 11/10 would pat accordingly",11,10,Mya,Not Specified
2704,778650543019483137,2016-09-21,"Meet Strider. He thinks he's a sorority girl. Already wants to go to NYC for a weekend to say he's ""studied abroad"" 10/10",10,10,Strider,Not Specified
2705,778624900596654080,2016-09-21,This is Penny. She's a sailor pup. 11/10 would take to the open seas with,11,10,Penny,Not Specified
2706,778408200802557953,2016-09-21,RIP Loki. Thank you for the good times. You will be missed by many. 14/10,14,10,,Not Specified
2707,778383385161035776,2016-09-21,This is Nala. She's a future Dogue model. Won't respond to my texts. 13/10 would be an honor to pet,13,10,Nala,Not Specified
2708,778286810187399168,2016-09-20,This is Stanley. He has too much skin. Isn't happy about it. Quite pupset actually. Still 11/10 would comfort,11,10,Stanley,Not Specified
2709,778039087836069888,2016-09-20,Evolution of a pupper yawn featuring Max. 12/10 groundbreaking stuff,12,10,,Not Specified
2710,778027034220126208,2016-09-20,This is Sophie. She's a Jubilant Bush Pupper. Super h*ckin rare. Appears at random just to smile at the locals. 11.27/10 would smile back,27,10,Sophie,Not Specified
2711,777885040357281792,2016-09-19,This is Wesley. He's clearly trespassing. Seems rather h*ckin violent too. Weaponized forehead. 3/10 wouldn't let in,3,10,Wesley,Not Specified
2712,777684233540206592,2016-09-19,"""Yep... just as I suspected. You're not flossing."" 12/10 and 11/10 for the pup not flossing",12,10,,Not Specified
2713,777621514455814149,2016-09-18,This is Derek. You can't look at him and not smile. Must've just had a blue pupsicle. 12/10 would snug intensely,12,10,Derek,Not Specified
2714,777189768882946048,2016-09-17,This is Jeffrey. He's being held so he doesn't fly away. 12/10 would set free,12,10,Jeffrey,Not Specified
2715,776813020089548800,2016-09-16,Meet Solomon. He was arrested for possession of adorable and attempted extra pats on the head. 12/10 would post bail,12,10,Solomon,Not Specified
2716,776477788987613185,2016-09-15,This is Huck. He's addicted to caffeine. Hope it's not too latte to seek help. 11/10 stay strong pupper,11,10,Huck,Not Specified
2717,776218204058357768,2016-09-15,Atlas rolled around in some chalk and now he's a magical rainbow floofer. 13/10 please never take a bath,13,10,,floofer
2718,776201521193218049,2016-09-14,This is O'Malley. That is how he sleeps. Doesn't care what you think about it. 10/10 comfy af,10,10,O,Not Specified
2719,776113305656188928,2016-09-14,This is Sampson. He's about to get hit with a vicious draw 2. Has no idea. 11/10 poor pupper,11,10,Sampson,Not Specified
2720,776088319444877312,2016-09-14,I can't tap the screen to make the hearts appear fast enough. 10/10 for the source of all future unproductiveness,10,10,,Not Specified
2721,775842724423557120,2016-09-13,This is Blue. He was having an average day until his owner told him about Bront. 12/10 h*ckin hysterical af,12,10,Blue,Not Specified
2722,775733305207554048,2016-09-13,This is Anakin. He strives to reach his full doggo potential. Born with blurry tail tho. 11/10 would still pet well,11,10,Anakin,Not Specified
2723,775729183532220416,2016-09-13,This girl straight up rejected a guy because he doesn't like dogs. She is my hero and I give her 13/10,13,10,,Not Specified
2724,775364825476165632,2016-09-12,This is Finley. He's an independent doggo still adjusting to life on his own. 11/10,11,10,Finley,Not Specified
2725,775350846108426240,2016-09-12,This is Maximus. A little rain won't stop him. He will persevere. 12/10 innovative af ,12,10,Maximus,Not Specified
2726,775085132600442880,2016-09-11,This is Tucker. He would like a hug. 13/10 someone hug him,13,10,Tucker,Not Specified
2727,774757898236878852,2016-09-10,This is Finley. She's a Beneboop Cumbersplash. 12/10 I'd do unspeakable things for Finley,12,10,Finley,Not Specified
2728,774639387460112384,2016-09-10,This is Sprinkles. He's trapped in light jail. 10/10 would post bail for him,10,10,Sprinkles,Not Specified
2729,774314403806253056,2016-09-09,I WAS SENT THE ACTUAL DOG IN THE PROFILE PIC BY HIS OWNER THIS IS SO WILD. 14/10 ULTIMATE LEGEND STATUS,14,10,,Not Specified
2730,773985732834758656,2016-09-08,Meet Winnie. She just made awkward eye contact with the driver beside her. Poor pupper panicked. 11/10 would comfort,11,10,Winnie,Not Specified
2731,773922284943896577,2016-09-08,"This is Heinrich (pronounced ""Pat""). He's a Botswanian Vanderfloof. Snazzy af bandana. 12/10 downright puptacular",12,10,Heinrich,Not Specified
2732,773704687002451968,2016-09-08,This is Loki. He knows he's adorable. One ear always pupared. 12/10 would snug in depicted fashion forever,12,10,Loki,Not Specified
2733,773670353721753600,2016-09-07,This is Shakespeare. He appears to be maximum level pettable. Born with no eyes tho (tragic). 10/10 probably wise,10,10,Shakespeare,Not Specified
2734,773547596996571136,2016-09-07,This is Chelsea. She forgot how to dog. 11/10 get it together pupper,11,10,Chelsea,Not Specified
2735,773308824254029826,2016-09-06,This is Bungalo. She uses that face to get what she wants. It works unbelievably well. 12/10 would never say no to,12,10,Bungalo,Not Specified
2736,773247561583001600,2016-09-06,This is Chip. He's a pupholder. Comes with the car. Requires frequent pettings. Shifts for you. 10/10 innovative af,10,10,Chip,Not Specified
2737,773191612633579521,2016-09-06,This is Grey. He's the dogtor in charge of your checkpup today. 12/10 I'd never miss an appointment,12,10,Grey,Not Specified
2738,772877495989305348,2016-09-05,You need to watch these two doggos argue through a cat door. Both 11/10,11,10,,Not Specified
2739,772826264096874500,2016-09-05,"Meet Roosevelt. He's preparing for takeoff. Make sure tray tables are in their full pupright &amp; licked position
11/10",11,10,Roosevelt,Not Specified
2740,772581559778025472,2016-09-04,Guys this is getting so out of hand. We only rate dogs. This is a Galapagos Speed Panda. Pls only send dogs... 10/10,10,10,,Not Specified
2741,772193107915964416,2016-09-03,This is Willem. He's a Penn State pupper. Thinks the hood makes him more intimidating. It doesn't. 12/10,12,10,Willem,Not Specified
2742,772152991789019136,2016-09-03,Here's a couple rufferees making sure all the sports are played fairly today. Both 10/10 would bribe with extra pets,10,10,,Not Specified
2743,772117678702071809,2016-09-03,Meet Jack. He's a Clemson pup. Appears to be rather h*ckin pettable. Almost makes me want to root for Clemson. 12/10,12,10,Jack,Not Specified
2744,772114945936949249,2016-09-03,This is Finn. He's very nervous for the game. Has a lot of money riding on it.10/10 would attempt to comfort,10,10,Finn,Not Specified
2745,772102971039580160,2016-09-03,This is Penny. She's an OU cheerleader. About to do a triple back handspring down the stairs. 11/10 hype af,11,10,Penny,Not Specified
2746,771908950375665664,2016-09-03,Doggo will persevere. 13/10,13,10,,Not Specified
2747,771770456517009408,2016-09-02,This is Davey. He'll have your daughter home by 8. Just a stand up pup. 11/10 would introduce to mom,11,10,Davey,Not Specified
2748,771500966810099713,2016-09-02,This is Dakota. He's just saying hi. That's all. 12/10 someone wave back,12,10,Dakota,Not Specified
2749,771380798096281600,2016-09-01,Meet Fizz. She thinks love is a social construct consisting solely of ideals perpetuated by mass media 11/10 woke af,11,10,Fizz,Not Specified
2750,771136648247640064,2016-09-01,This is Dixie. She wants to be a ship captain. Won't let anything get in between her and her dreams. 11/10,11,10,Dixie,Not Specified
2751,771102124360998913,2016-08-31,This is Charlie. He works for @TODAYshow. Super sneaky tongue slip here. 12/10 would pet until someone made me stop,12,10,Charlie,Not Specified
2752,771014301343748096,2016-08-31,Another pic without a dog in it? What am I supposed to do? Rate the carpet? Fine I will. 7/10 looks adequately comfy,7,10,,Not Specified
2753,770787852854652928,2016-08-31,This is Winston. His tongue has gone rogue. Doing him quite a frighten. 10/10 hang in there Winston,10,10,Winston,Not Specified
2754,770772759874076672,2016-08-30,This is Sebastian. He's super h*ckin fluffy. That's really all you need to know. 11/10 would snug intensely,11,10,Sebastian,Not Specified
2755,770655142660169732,2016-08-30,We only rate dogs. Pls stop sending in non-canines like this Arctic Floof Kangaroo. This is very frustrating. 11/10,11,10,,Not Specified
2756,770414278348247044,2016-08-30,Meet Al Cabone. He's a gangsta puppa. Rather h*ckin ruthless. Shows no mercy sometimes. 11/10 pet w extreme caution,11,10,Al,Not Specified
2757,770293558247038976,2016-08-29,This is Jackson. There's nothing abnormal about him. Just your average really good dog. 10/10,10,10,Jackson,Not Specified
2758,770069151037685760,2016-08-29,Say hello to Carbon. This is his first time swimming. He's having a h*ckin blast. 10/10 we should all be this happy,10,10,Carbon,Not Specified
2759,769940425801170949,2016-08-28,This is Klein. These pics were taken a month apart. He knows he's a stud now. 12/10 total heartthrob,12,10,Klein,Not Specified
2760,769695466921623552,2016-08-28,This is Titan. He's trying to make friends. Offering up his favorite stick. 13/10 philanthropic af,13,10,Titan,Not Specified
2761,769212283578875904,2016-08-26,This is DonDon. He's way up but doesn't feel blessed. Rather uncomfortable actually. 12/10 I'll save you DonDon,12,10,DonDon,Not Specified
2762,768970937022709760,2016-08-26,This is Kirby. His bowl weighs more than him. 12/10 would assist,12,10,Kirby,Not Specified
2763,768855141948723200,2016-08-25,This is Jesse. He really wants a belly rub. Will be as cute as possible to achieve that goal. 11/10,11,10,Jesse,Not Specified
2764,768609597686943744,2016-08-25,This is Lou. His sweater is too small and he already cut the tags off. Very very churlish. 10/10 would still pet,10,10,Lou,Not Specified
2765,768596291618299904,2016-08-24,Say hello to Oakley and Charlie. They're convinced that they each have their own stick. Nobody tell them. Both 12/10,12,10,Oakley,Not Specified
2766,768473857036525572,2016-08-24,Meet Chevy. He had a late breakfast and now has to choose between a late lunch or an early dinner. 11/10 very pupset,11,10,Chevy,Not Specified
2767,768193404517830656,2016-08-23,Meet Gerald. He's a fairly exotic doggo. Floofy af. Inadequate knees tho. Self conscious about large forehead. 8/10,8,10,Gerald,Not Specified
2768,767884188863397888,2016-08-23,This is Tito. He's on the lookout. Nobody knows for what. 10/10,10,10,Tito,Not Specified
2769,767754930266464257,2016-08-22,This is Philbert. His toilet broke and he doesn't know what to do. Trying not to panic. 11/10 furustrated af,11,10,Philbert,Not Specified
2770,767500508068192258,2016-08-21,This is Louie. He's making quite a h*ckin mess. Doesn't seem to care. 12/10 jubilant af,12,10,Louie,Not Specified
2771,767191397493538821,2016-08-21,I don't know any of the backstory behind this picture but for some reason I'm crying. 13/10 for owner and doggo,13,10,,Not Specified
2772,767122157629476866,2016-08-20,This is Rupert. You betrayed him with bath time but he forgives you. Cuddly af 13/10,13,10,Rupert,Not Specified
2773,766793450729734144,2016-08-20,This is Rufus. He just missed out on the 100m final at Rio. Already training hard for Tokyo. 10/10 never give pup,10,10,Rufus,Not Specified
2774,766693177336135680,2016-08-19,This is Brudge. He's a Doberdog. Going to be h*ckin massive one day. 11/10 would pat on head approvingly,11,10,Brudge,Not Specified
2775,766423258543644672,2016-08-18,This is Shadoe. Her tongue flies out of her mouth at random. Can't have a serious conversation with her. 9/10,9,10,Shadoe,Not Specified
2776,766313316352462849,2016-08-18,This is Oscar. He has legendary eyebrows and he h*ckin knows it. Curly af too. 12/10 would hug passionately,12,10,Oscar,Not Specified
2777,766069199026450432,2016-08-18,This is Juno. She can see your future. 12/10 h*ckin mesmerizing af,12,10,Juno,Not Specified
2778,766008592277377025,2016-08-17,This is Angel. She stole the @ShopWeRateDogs shirt from her owner. Fits pretty well actually. 11/10 would forgive,11,10,Angel,Not Specified
2779,765719909049503744,2016-08-17,This is Brat. He has a hard time being ferocious so his owner helps out. H*ckin scary af now. 12/10 would still pet,12,10,Brat,Not Specified
2780,765669560888528897,2016-08-16,This is Tove. She's a Balsamic Poinsetter. Surprisingly deadly. 12/10 snug with caution,12,10,Tove,Not Specified
2781,765395769549590528,2016-08-16,This is my dog. Her name is Zoey. She knows I've been rating other dogs. She's not happy. 13/10 no bias at all,13,10,,Not Specified
2782,765371061932261376,2016-08-16,This is Louie. He's had a long day. Did a lot of pupper things. Also appears to be rather heckin pettable. 11/10,11,10,Louie,Not Specified
2783,765222098633691136,2016-08-15,This is Gromit. He's pupset because there's no need to beware of him. Just wants a pettin. 10/10,10,10,Gromit,Not Specified
2784,764857477905154048,2016-08-14,This is Aubie. He has paws for days. Nibbling tables is one of his priorities. Second only to being cuddly af. 12/10,12,10,Aubie,Not Specified
2785,764259802650378240,2016-08-13,This is Kota and her son Benedict. She doesn't know why you're staring. They are a normal family. Both 10/10,10,10,Kota,Not Specified
2786,763837565564780549,2016-08-11,This is Alfie. He's touching a butt. Couldn't be happier. 11/10,11,10,Alfie,Not Specified
2787,763183847194451968,2016-08-10,This is Clark. He collects teddy bears. It's absolutely h*ckin horrifying. 8/10 please stop this Clark,8,10,Clark,Not Specified
2788,763103485927849985,2016-08-09,This is Belle. She's a Butterflop Hufflepoof. Rarer than most. Having trouble with car seat. 10/10 perturbed af,10,10,Belle,Not Specified
2789,762699858130116608,2016-08-08,This is Leela. She's a Fetty Woof. Lost eye while saving a baby from an avalanche. 11/10 true h*ckin hero,11,10,Leela,Not Specified
2790,762471784394268675,2016-08-08,Meet Glenn. Being in public scares him. Frighteningly relatable. 12/10 keep hangin in there Glenn (Imgur - Wuhahha),12,10,Glenn,Not Specified
2791,762464539388485633,2016-08-08,This is Buddy. His father was a bear and his mother was a perfectly toasted marshmallow. 12/10 would snug so well,12,10,Buddy,Not Specified
2792,762316489655476224,2016-08-07,This is Scout. He specializes in mid-air freeze frames. 11/10,11,10,Scout,Not Specified
2793,762035686371364864,2016-08-06,This left me speechless. 14/10 heckin heroic af,14,10,,Not Specified
2794,761976711479193600,2016-08-06,This is Shelby. She finds stuff to put on her head for attention. It works really well. 12/10 talented af,12,10,Shelby,Not Specified
2795,761745352076779520,2016-08-06,Guys.. we only rate dogs. Pls don't send any more pics of the Loch Ness Monster. Only send in dogs. Thank you. 11/10,11,10,,Not Specified
2796,761672994376806400,2016-08-05,Ohboyohboyohboyohboyohboyohboyohboyohboyohboyohboyohboyohboyohboyohboyohboy. 10/10 for all (by happytailsresort),10,10,,Not Specified
2797,761599872357261312,2016-08-05,"This is Sephie. According to this picture, she can read. Fantastic at following directions. 11/10 such a good girl",11,10,Sephie,Not Specified
2798,761334018830917632,2016-08-04,This is Bruce. I really want to hear the joke he was told. 10/10 for chuckle pup,10,10,Bruce,Not Specified
2799,761292947749015552,2016-08-04,Meet Bonaparte. He's pupset because it's cloudy at the beach. Can't take any pics for his Instagram. 11/10,11,10,Bonaparte,Not Specified
2800,761227390836215808,2016-08-04,This is Albert. He just found out that bees are dying globally at an alarming rate. 10/10 heckin worried af now,10,10,Albert,Not Specified
2801,761004547850530816,2016-08-04,This is Bo and Ty. Bo eats paper and Ty felt left out. 11/10 for both,11,10,Bo,Not Specified
2802,760893934457552897,2016-08-03,This is Wishes. He has the day off. Daily struggles of being a doggo have finally caught up with him. 11/10,11,10,Wishes,Not Specified
2803,760656994973933572,2016-08-03,This is Rose. Her face is stuck like that. 11/10 would pet so heckin well,11,10,Rose,Not Specified
2804,760641137271070720,2016-08-03,This is Theo. He can walk on water. Still coming to terms with it. 12/10 magical af,12,10,Theo,Not Specified
2805,760539183865880579,2016-08-02,This is Atlas. Swinging is his passion. 12/10 would push all day,12,10,Atlas,Not Specified
2806,760521673607086080,2016-08-02,"Doggo want what doggo cannot have. Temptation strong, dog stronger. 12/10 ",12,10,,Not Specified
2807,760290219849637889,2016-08-02,This is Rocco. He's doing his best. 13/10 someone help him (IG: rocco_roni),13,10,Rocco,Not Specified
2808,760252756032651264,2016-08-01,This is Fido. He can tell the weather. Not good at fetch tho. Never comes when called. 4/10 would probably still pet,4,10,Fido,Not Specified
2809,760190180481531904,2016-08-01,Meet Sadie. She's addicted to balloons. It's tearing her family apart. Won't admit she has a problem. Still 10/10,10,10,Sadie,Not Specified
2810,759943073749200896,2016-08-01,Here's a wicked fast pupper. 12/10 camera could barely keep pup,12,10,,Not Specified
2811,759923798737051648,2016-08-01,We only rate dogs... this is a Taiwanese Guide Walrus. Im getting real heckin tired of this. Please send dogs. 10/10,10,10,,Not Specified
2812,759846353224826880,2016-07-31,This is Kirby. He's a Beneblip Cumberpat. Pretty heckin rare. 11/10 would put my face against his face,11,10,Kirby,Not Specified
2813,759793422261743616,2016-07-31,"Meet Maggie &amp; Lila. Maggie is the doggo, Lila is the pupper. They are sisters. Both 12/10 would pet at the same time",12,10,Maggie,Not Specified
2814,759557299618865152,2016-07-31,This is Emma. She can't believe her last guess didn't hit. Convinced ur stacking them on top of each other. 10/10,10,10,Emma,Not Specified
2815,759447681597108224,2016-07-30,This is Oakley. He has no idea what happened here. Even offered to help clean it up. 11/10 such a heckin good boy,11,10,Oakley,Not Specified
2816,759446261539934208,2016-07-30,No no no this is all wrong. The Walmart had to have run into the dog driving the car. 10/10 someone tell him it's ok,10,10,,Not Specified
2817,759197388317847553,2016-07-30,This is Luna. She's just heckin precious af I have nothing else to say. 12/10,12,10,Luna,Not Specified
