,tweet_id,timestamp,text,rating_numerator,rating_denominator,name,characteristic
3159,711008018775851008,2016-03-19,This is Chuckles. He had a balloon but he accidentally let go of it and it floated away. 11/10 hang in there pupper,11,10,Chuckles,Not Specified
3160,710997087345876993,2016-03-19,Meet Milo and Amos. They are the best of pals. Both 12/10 would pet at the same time,12,10,Milo,Not Specified
3161,710844581445812225,2016-03-18,This is Staniel. His selfie game is strong af. 10/10 I'd snapchat with Staniel,10,10,Staniel,Not Specified
3162,710833117892898816,2016-03-18,Say hello to Sora. She's an Egyptian Pumpernickel. Mesmerizing af. 12/10 would bring home to mom,12,10,Sora,Not Specified
3163,710658690886586372,2016-03-18,Here's a brigade of puppers. All look very prepared for whatever happens next. 80/80,80,80,,Not Specified
3164,710609963652087808,2016-03-17,I've watched this a million times and you probably will too. 12/10 (vid by @emily_galasso),12,10,,Not Specified
3165,710588934686908417,2016-03-17,This is Beemo. He's a Chubberflop mix. 12/10 would cross the world for,12,10,Beemo,Not Specified
3166,710296729921429505,2016-03-17,This is Oshie. 12/10 please enjoy (vid by @catherinec1389),12,10,Oshie,Not Specified
3167,710283270106132480,2016-03-17,This is Gunner. He's a Figamus Newton. King of the peek-a-boo. Cool jeans. 11/10,11,10,Gunner,Not Specified
3168,710272297844797440,2016-03-17,We ðŸ‘ðŸ» only ðŸ‘ðŸ» rate ðŸ‘ðŸ» dogs. Pls stop sending in non-canines like this Dutch Panda Worm. This is infuriating. 11/10,11,10,,Not Specified
3169,710269109699739648,2016-03-17,"The squad is back for St. Patrick's Day! â˜˜ ðŸ’š
13/10 for all",13,10,,Not Specified
3170,710153181850935296,2016-03-16,This is Lacy. She's tipping her hat to you. Daydreams of her life back on the frontier. 11/10 would pet so well,11,10,Lacy,Not Specified
3171,710140971284037632,2016-03-16,This is Tater. His underbite is fierce af. Doesn't give a damn about your engagement photo. 8/10,8,10,Tater,Not Specified
3172,710117014656950272,2016-03-16,This pupper got her hair chalked for her birthday. Hasn't told her parents yet. Rebellious af. 11/10 very nifty,11,10,,Not Specified
3173,709918798883774466,2016-03-16,Meet Watson. He's a Suzuki Tickleboop. Leader of a notorious biker gang. Only one ear functional. 12/10 snuggable af,12,10,Watson,Not Specified
3174,709901256215666688,2016-03-16,"WeRateDogs stickers are here and they're 12/10! Use code ""puppers"" at checkout ðŸ¶ðŸ¾

Shop now: https://t.co/k5xsufRKYm",12,10,,Not Specified
3175,709852847387627521,2016-03-15,*lets out a tiny whimper and then collapses* ...12/10,12,10,,Not Specified
3176,709566166965075968,2016-03-15,This is Olaf. He's gotta be rare. Seems sturdy. Tail is floofy af. 12/10 would do whatever it takes to pet,12,10,Olaf,Not Specified
3177,709556954897764353,2016-03-15,This is Cecil. She's a Gigglefloof Poofer. Outdoorsy af. One with nature. 12/10 would strategically capture,12,10,Cecil,Not Specified
3178,709519240576036864,2016-03-14,This is Vince. He's a Gregorian Flapjeck. White spot on legs almost looks like another dog (whoa). 9/10 rad as hell,9,10,Vince,Not Specified
3179,709449600415961088,2016-03-14,Meet Karma. She's just a head. Lost body during the Second Punic War (unfortunate). Loves to travel 10/10 petable af,10,10,Karma,Not Specified
3180,709409458133323776,2016-03-14,This is Billy. He sensed a squirrel. 8/10 damn it Billy,8,10,Billy,Not Specified
3181,709225125749587968,2016-03-14,This is Walker. He's a Butternut Khalifa. Appears fuzzy af. 11/10 would hug for a ridiculous amount of time,11,10,Walker,Not Specified
3182,709207347839836162,2016-03-14,This is Penny. She's trying on her prom dress. Stunning af 11/10,11,10,Penny,Not Specified
3183,709198395643068416,2016-03-14,"From left to right:
Cletus, Jerome, Alejandro, Burp, &amp; Titson
None know where camera is. 45/50 would hug all at once",45,50,,Not Specified
3184,709179584944730112,2016-03-14,This is Sammy. He's in a tree. Very excited about it. 13/10,13,10,Sammy,Not Specified
3185,709158332880297985,2016-03-13,Meet Rodney. He's a Ukranian Boomchicka. Outside but would like to be inside. Only has one ear (unfortunate) 10/10,10,10,Rodney,Not Specified
3186,709042156699303936,2016-03-13,This is Klevin. He's addicted to sandwiches (yes a hotdog is a sandwich fight me) It's tearing his family apart 9/10,9,10,Klevin,Not Specified
3187,708853462201716736,2016-03-13,This is Lucy. She doesn't understand fetch. 8/10 try turning off and back on (vid by @rileyyoungblood),8,10,Lucy,Not Specified
3188,708845821941387268,2016-03-13,Here's a pupper with magic eyes. Not wearing a seat belt tho (irresponsible af). Very distracting to driver. 9/10,9,10,,Not Specified
3189,708834316713893888,2016-03-13,Meet Malikai. He was rolling around having fun when he remembered the inevitable heat death of the universe. 10/10,10,10,Malikai,Not Specified
3190,708810915978854401,2016-03-13,This is Mister. He's a wonderful father to his two pups. Heartwarming af. 10/10 for all,10,10,Mister,Not Specified
3191,708738143638450176,2016-03-12,This is Coco. She gets to stay on the Bachelor for another week. Super pumped 11/10,11,10,Coco,Not Specified
3192,708711088997666817,2016-03-12,This is Smokey. He really likes tennis balls. 11/10,11,10,Smokey,Not Specified
3193,708479650088034305,2016-03-12,Meet Bear. He's a Beneboop Cumberclap. Extremely unamused. 13/10 I'm in love with this picture,13,10,Bear,Not Specified
3194,708469915515297792,2016-03-12,This is Bobble. He's a Croatian Galifianakis. Hears everything within 400 miles. 11/10 would snug diligently,11,10,Bobble,Not Specified
3195,708400866336894977,2016-03-11,RT if you are as ready for summer as this pup is 12/10,12,10,,Not Specified
3196,708356463048204288,2016-03-11,This is Oliver. That is his castle. He protects it with his life. He's also squishy af. 10/10 would squish softly,10,10,Oliver,Not Specified
3197,708349470027751425,2016-03-11,This is River. He's changing the trumpet game. Innovative af. 11/10 such a good boy,11,10,River,Not Specified
3198,708149363256774660,2016-03-11,This is Jebberson. He's the reigning hide and seek world champion. 10/10 hasn't lost his touch,10,10,Jebberson,Not Specified
3199,708130923141795840,2016-03-11,Please stop sending in non canines like this Guatemalan Twiggle Bunny. We only rate dogs. Only send in dogs... 11/10,11,10,,Not Specified
3200,708119489313951744,2016-03-11,This is Cooper. He basks in the glory of rebellion. 9/10 probably a preteen,9,10,Cooper,Not Specified
3201,708109389455101952,2016-03-11,This is Remington. He was caught off guard by the magical floating cheese. Spooked af. 10/10 deep breaths pup,10,10,Remington,Not Specified
3202,708026248782585858,2016-03-10,Everybody stop what you're doing and watch this video. Frank is stuck in a loop. 13/10 (Vid by @klbmatty),13,10,,Not Specified
3203,707995814724026368,2016-03-10,This is Farfle. He lost his back legs during the Battle of Gettysburg. Goes 0-60 in 4.3 seconds (damn) 12/10 hero af,12,10,Farfle,Not Specified
3204,707969809498152960,2016-03-10,Meet Rufus. He's a Honeysuckle Firefox. Curly af. Badass tie. About to go on his first date ever 11/10 good luck pup,11,10,Rufus,Not Specified
3205,707776935007539200,2016-03-10,This is Sadie. She's a Bohemian Rhapsody. Remarkably portable. Could sneak on roller coasters with (probably). 11/10,11,10,Sadie,Not Specified
3206,707741517457260545,2016-03-10,When your roommate eats your leftover Chili's but you pretend it's no big deal cuz you fat anyway. 10/10 head up pup,10,10,,Not Specified
3207,707738799544082433,2016-03-10,He's doing his best. 12/10 very impressive that he got his license in the first place ,12,10,,Not Specified
3208,707693576495472641,2016-03-09,This is Jiminus. He's in a tub for some reason. What a jokester. Smh 7/10 churlish af,7,10,Jiminus,Not Specified
3209,707629649552134146,2016-03-09,We usually don't rate marshmallows but this one's having so much fun in the snow. 10/10 (vid by @kylejk24),10,10,,Not Specified
3210,707610948723478529,2016-03-09,This is Harper. She scraped her elbow attempting a backflip off a tree. Valiant effort tho. 12/10,12,10,Harper,Not Specified
3211,707420581654872064,2016-03-09,This is Keurig. He's a rare dog. Laughs like an idiot tho. Head is basically a weapon. Poorly maintained goatee 4/10,4,10,Keurig,Not Specified
3212,707411934438625280,2016-03-09,"""I shall trip the big pupper with leash. Big pupper will never see it coming. I am a genius."" Both 11/10",11,10,,Not Specified
3213,707387676719185920,2016-03-09,Meet Clarkus. He's a Skinny Eastern Worcestershire. Can tie own shoes (impressive af) 10/10 would put on track team,10,10,Clarkus,Not Specified
3214,707377100785885184,2016-03-09,This dog just brutally murdered a snowman. Currently toying with its nutritious remains 9/10 would totally still pet,9,10,,Not Specified
3215,707315916783140866,2016-03-08,This is Finnegus. He's trapped in a snow globe. Poor pupper. 10/10 would make sure no one shook it,10,10,Finnegus,Not Specified
3216,707297311098011648,2016-03-08,This is Cassie. She can go from sweet to scary af in a matter of seconds. 10/10 points deducted for cats on pajamas,10,10,Cassie,Not Specified
3217,707059547140169728,2016-03-08,Say hello to Cupcake. She's an Icelandic Dippen Dot. Confused by the oddly geometric lawn pattern. 11/10,11,10,Cupcake,Not Specified
3218,707038192327901184,2016-03-08,This is Kathmandu. He sees every move you make. Probably knows Jiu-Jitsu. 10/10 mysterious af,10,10,Kathmandu,Not Specified
3219,707021089608753152,2016-03-08,This is Tucker. He's a Dasani Episcopalian. Good lord what a tongue. 12/10 would never let go of,12,10,Tucker,Not Specified
3220,707014260413456384,2016-03-08,This is Ellie. She requests to be carried around in a lacrosse stick at all times. 11/10 impossible to say no,11,10,Ellie,Not Specified
3221,706904523814649856,2016-03-07,Ever seen a dog pet another dog? Both 13/10 truly an awe-inspiring scene. (Vid by @mdougherty20),13,10,,Not Specified
3222,706901761596989440,2016-03-07,This is Elliot. He's blocking the roadway. Downright rude as hell. Doesn't care that you're already late. 3/10,3,10,Elliot,Not Specified
3223,706681918348251136,2016-03-07,Say hello to Katie. She's a Mitsubishi Hufflepuff. Curly af. 12/10 I'd do terrible things to acquire such a pup,12,10,Katie,Not Specified
3224,706644897839910912,2016-03-07,Meet Shadow. She's tired of the responsibilities associated with being a dog. No longer strives to attain ball. 9/10,9,10,Shadow,Not Specified
3225,706593038911545345,2016-03-06,Here's a sneak peek of me on spring break. 10/10 so many tired pups these days,10,10,,Not Specified
3226,706538006853918722,2016-03-06,"This is Oliver (pronounced ""Ricardo""). He's a ship captain. Controls these treacherous waters. 11/10 would sail with",11,10,Oliver,Not Specified
3227,706516534877929472,2016-03-06,Please enjoy this pup in a cooler. Permanently ready for someone to throw a tennis ball his way. 12/10,12,10,,Not Specified
3228,706346369204748288,2016-03-06,This is Koda. She's a Beneboom Cumberwiggle. 12/10 petable as hell,12,10,Koda,Not Specified
3229,706310011488698368,2016-03-06,Here's a very sleepy pupper. Thinks it's an airplane. 12/10 would snug for eternity,12,10,,Not Specified
3230,706291001778950144,2016-03-06,When you're just relaxin and having a swell time but then remember you have to fill out the FAFSA ...11/10,11,10,,Not Specified
3231,706265994973601792,2016-03-05,"This is Kara. She's been trying to solve that thing for 3 days. ""I don't have thumbs,"" she said. 11/10 solid effort",11,10,Kara,Not Specified
3232,706169069255446529,2016-03-05,He was doing his best. 12/10 I'll be his lawyer,12,10,,Not Specified
3233,706166467411222528,2016-03-05,This is Dexter. He's a shy pup. Doesn't bark much. Dreadful fetcher. Has rare sun allergy. 7/10 still petable,7,10,Dexter,Not Specified
3234,706153300320784384,2016-03-05,This is Layla. She's giving you a standing ovation.13/10 just magnificent (vid by @CSBrzezinski),13,10,Layla,Not Specified
3235,705975130514706432,2016-03-05,This is Adele. Her tongue flies out of her mouth at random. It's a debilitating illness. 10/10 stay strong pupper,10,10,Adele,Not Specified
3236,705970349788291072,2016-03-05,This is Lucy. She's a Venetian Kerploof. Supposed to be navigating. Quite irresponsible. Fancy ass collar tho 12/10,12,10,Lucy,Not Specified
3237,705898680587526145,2016-03-04,Meet Max. He's a Fallopian Cephalopuff. Eyes are magical af. Lil dandruff problem. No big deal 10/10 would still pet,10,10,Max,Not Specified
3238,705786532653883392,2016-03-04,"Seriously, add us ðŸ¶ 11/10 for sad wet pupper",11,10,,Not Specified
3239,705591895322394625,2016-03-04,"""Ma'am, for the last time, I'm not authorized to make that type of transaction"" 11/10",11,10,,Not Specified
3240,705475953783398401,2016-03-03,Say hello to Zara. She found a sandal and couldn't be happier. 12/10 great work,12,10,Zara,Not Specified
3241,705442520700944385,2016-03-03,This is Cooper. He only wakes up to switch gears. 12/10 helpful af,12,10,Cooper,Not Specified
3242,705428427625635840,2016-03-03,This is Ambrose. He's an Alfalfa Ballyhoo. Draws pistol fast af. Pretty much runs the frontier. 11/10 lethal pupper,11,10,Ambrose,Not Specified
3243,705239209544720384,2016-03-03,This is Jimothy. He lost his body during the the Third Crusade (tragic). 11/10 heroic af tho,11,10,Jimothy,Not Specified
3244,705223444686888960,2016-03-03,This is Bode. He's a heavy sleeper. 9/10,9,10,Bode,Not Specified
3245,705102439679201280,2016-03-02,This is Terrenth. He just stubbed his toe. 10/10 deep breaths Terrenth,10,10,Terrenth,Not Specified
3246,705066031337840642,2016-03-02,This is Reese. He's a Chilean Sohcahtoa. Loves to swing. Never sure what to do with his feet. 12/10 huggable af,12,10,Reese,Not Specified
3247,704871453724954624,2016-03-02,I found a forest Pipsy. 12/10,12,10,,Not Specified
3248,704859558691414016,2016-03-02,Here is a heartbreaking scene of an incredible pupper being laid to rest. 10/10 RIP pupper,10,10,,Not Specified
3249,704847917308362754,2016-03-02,"""Yes hi could I get a number 4 with no pickles"" ...12/10",12,10,,Not Specified
3250,704819833553219584,2016-03-02,This is Chesterson. He's a Bolivian Scoop Dog. Incredibly portable. Can't bark for shit tho. 7/10 would still pet,7,10,Chesterson,Not Specified
3251,704761120771465216,2016-03-01,This pupper killed this great white in an epic sea battle. Now wears it as a trophy. Such brave. Much fierce. 13/10,13,10,,Not Specified
3252,704499785726889984,2016-03-01,When you wake up from a long nap and have no idea who you are. 12/10,12,10,,Not Specified
3253,704480331685040129,2016-03-01,Meet Lucia. She's a Cumulonimbus Floofmallow. Only has two legs tho (unfortunate). 11/10 would definitely still pet,11,10,Lucia,Not Specified
3254,704364645503647744,2016-02-29,Say hello to Bisquick. He's a Beneplop Cumbersnug. Even smiles when wet. 12/10 I'd steal Bisquick,12,10,Bisquick,Not Specified
3255,704347321748819968,2016-02-29,This is Ralphson. He's very confused. Wondering why he's sitting on Santa's lap in February. 10/10 stay woke pupper,10,10,Ralphson,Not Specified
3256,704134088924532736,2016-02-29,This sneezy pupper is just adorable af. 12/10 (vid by @gwilks1),12,10,,Not Specified
3257,704113298707505153,2016-02-29,Meet Stanley. He's an inverted Uzbekistani water pup. Hella exotic. Floats around all day. 8/10 I want to be Stanley,8,10,Stanley,Not Specified
3258,704054845121142784,2016-02-28,Here is a whole flock of puppers.  60/50 I'll take the lot,60,50,,Not Specified
3259,703774238772166656,2016-02-28,"""YOU CAN'T HANDLE THE TRUTH"" both 10/10",10,10,,Not Specified
3260,703769065844768768,2016-02-28,When you're trying to watch your favorite tv show but your friends keep interrupting. 10/10 relatable af,10,10,,Not Specified
3261,703631701117943808,2016-02-27,This is Bella. Based on this picture she's at least 8ft tall (wow)! Must be rare. 11/10 would pet on tippy toes,11,10,Bella,Not Specified
3262,703611486317502464,2016-02-27,Meet Scooter. He's experiencing the pupper equivalent of dropping ur phone in a toilet 10/10 put it in some rice pup,10,10,Scooter,Not Specified
3263,703425003149250560,2016-02-27,"Really guys? Again? I know this is a rare Albanian Bingo Seal, but we only rate dogs. Only send in dogs... 9/10",9,10,,Not Specified
3264,703407252292673536,2016-02-27,This pupper doesn't understand gates. 10/10 so close,10,10,,Not Specified
3265,703382836347330562,2016-02-27,This is Charlie. He's a West Side Niddlewog. Mucho fluffy. 12/10 would pet so damn well,12,10,Charlie,Not Specified
3266,703356393781329922,2016-02-26,This is Socks. That water pup w the super legs just splashed him. Socks did not appreciate that. 9/10 and 2/10,9,10,Socks,Not Specified
3267,703268521220972544,2016-02-26,Happy Friday here's a sleepy pupper 12/10,12,10,,Not Specified
3268,703079050210877440,2016-02-26,This is a Butternut Cumberfloof. It's not windy they just look like that. 11/10 back at it again with the red socks,11,10,,Not Specified
3269,703041949650034688,2016-02-26,This is an East African Chalupa Seal. We only rate dogs. Please only send in dogs. Thank you... 10/10,10,10,,Not Specified
3270,702932127499816960,2016-02-25,This is Chip. He's an Upper West Nile Pantaloon. Extremely deadly. Will rip your throat out. 6/10 might still pet,6,10,Chip,Not Specified
3271,702899151802126337,2016-02-25,Say hello to Luna. Her tongue is malfunctioning (tragic). 12/10 please enjoy (vid by @LilyArtz),12,10,Luna,Not Specified
3272,702684942141153280,2016-02-25,This is Lucy. She's sick of these bullshit generalizations 11/10,11,10,Lucy,Not Specified
3273,702671118226825216,2016-02-25,Meet Rambo &amp; Kiwi. Rambo's the pup with the sharp toes &amp; rad mohawk. One stays woke while one sleeps. 10/10 for both,10,10,Rambo,Not Specified
3274,702598099714314240,2016-02-24,"This is Sansa. She's gotten too big for her chair. Not so smol anymore. 11/10 once a pupper, always a pupper",11,10,Sansa,Not Specified
3275,702539513671897089,2016-02-24,This is a Wild Tuscan Poofwiggle. Careful not to startle. Rare tongue slip. One eye magical. 12/10 would def pet,12,10,,Not Specified
3276,702332542343577600,2016-02-24,This is Rudy. He's going to be a star. 13/10 talented af (vid by @madalynrossi),13,10,Rudy,Not Specified
3277,702321140488925184,2016-02-24,Please enjoy this picture as much as I did. 12/10,12,10,,Not Specified
3278,702276748847800320,2016-02-23,"""AND IIIIIIIIIIIEIIIIIIIIIIIII WILL ALWAYS LOVE YOUUUUU"" 11/10",11,10,,Not Specified
3279,702217446468493312,2016-02-23,"I know it's tempting, but please stop sending in pics of Donald Trump. Thank you ...9/10",9,10,,Not Specified
3280,701981390485725185,2016-02-23,This is Fiji. She's a Powdered Stegafloof. Very rare. 12/10,12,10,Fiji,Not Specified
3281,701952816642965504,2016-02-23,Meet Rilo. He's a Northern Curly Ticonderoga. Currently balancing on one paw even in strong wind. Acrobatic af 11/10,11,10,Rilo,Not Specified
3282,701889187134500865,2016-02-22,This is Bilbo. He's not emotionally prepared to enter the water. 11/10 don't struggle Bilbo,11,10,Bilbo,Not Specified
3283,701805642395348998,2016-02-22,Please pray for this pupper. Nothing wrong with her she just can't stop getting hit with banana peels. 11/10,11,10,,Not Specified
3284,701601587219795968,2016-02-22,This is Coopson. He's a Blingin Schnitzel. Built fence himself. One ear is slightly defective. 10/10 would still pet,10,10,Coopson,Not Specified
3285,701570477911896070,2016-02-22,This is Yoda. He's a Zimbabwean Rutabaga. Freaks out if u stop scratching his belly. Incredibly self-centered. 9/10,9,10,Yoda,Not Specified
3286,701545186879471618,2016-02-21,Meet Millie. She's practicing her dive form for Rio. It's nearly perfect. Dedicated af. 10/10 go for gold pupper,10,10,Millie,Not Specified
3287,701214700881756160,2016-02-21,"I'm not sure what's happening here, but it's pretty spectacular. 12/10 for both",12,10,,Not Specified
3288,700890391244103680,2016-02-20,This is Chet. He's dapper af. His owners want him to learn how to dance but his true passion is potato guns. 11/10,11,10,Chet,Not Specified
3289,700864154249383937,2016-02-20,"""Pupper is a present to world. Here is a bow for pupper."" 12/10 precious as hell",12,10,,Not Specified
3290,700847567345688576,2016-02-20,Meet Crouton. He's a Galapagos Boonwiddle. Has a legendary tongue (most Boonwiddles do). Excellent stuff 10/10,10,10,Crouton,Not Specified
3291,700796979434098688,2016-02-19,This is Daniel. He's a neat pup. Exotic af. Custom paws. Leaps unannounced. Would totally pet. 7/10 daaamn Daniel,7,10,Daniel,Not Specified
3292,700747788515020802,2016-02-19,We only rate dogs. Pls stop sending in non-canines like this Mongolian grass snake. This is very frustrating. 11/10,11,10,,Not Specified
3293,700518061187723268,2016-02-19,This is Vincent. He's the man your girl is with when she's not with you. 10/10,10,10,Vincent,Not Specified
3294,700505138482569216,2016-02-19,This is Kaia. She's just cute as hell. 12/10 I'd kill for Kaia,12,10,Kaia,Not Specified
3295,700462010979500032,2016-02-18,This is Murphy. He's a mini golden retriever. Missing two legs (tragic). Mouth sharp. Looks rather perturbed. 6/10,6,10,Murphy,Not Specified
3296,700167517596164096,2016-02-18,This is Dotsy. She's stuck as hell. 10/10,10,10,Dotsy,Not Specified
3297,700151421916807169,2016-02-18,If a pupper gave that to me I'd probably start shaking and faint from all the joy. 11/10,11,10,,Not Specified
3298,700143752053182464,2016-02-18,When it's Janet from accounting's birthday but you can't eat the cake cuz it's chocolate. 10/10 hang in there pupper,10,10,,Not Specified
3299,700062718104104960,2016-02-17,This is Eazy-E. He's colorful af. Must be rare. Submerged in Sprite (rad). Doesn't perform well when not wet. 6/10,6,10,Eazy,Not Specified
3300,700029284593901568,2016-02-17,This is Coops. His ship is taking on water. Sound the alarm. Much distress. Requesting immediate assistance. 10/10,10,10,Coops,Not Specified
3301,700002074055016451,2016-02-17,This is Thumas. He covered himself in nanners for maximum camouflage. It didn't work. I can still see u Thumas. 9/10,9,10,Thumas,Not Specified
3302,699801817392291840,2016-02-17,This is Cooper. He began to tear up when his bone was taken from him. 11/10 stay strong pupper,11,10,Cooper,Not Specified
3303,699788877217865730,2016-02-17,Say hello to Nala. She's a Freckled High Bruschetta. Petable af. 12/10,12,10,Nala,Not Specified
3304,699779630832685056,2016-02-17,Take all my money. 10/10,10,10,,Not Specified
3305,699775878809702401,2016-02-17,Meet Fillup. Spaghetti is his main weakness. Also pissed because he's rewarded with cat treats 11/10 it'll be ok pup,11,10,Fillup,Not Specified
3306,699691744225525762,2016-02-16,"This is Dave. He's a tropical pup. Short lil legs (dachshund mix?) Excels underwater, but refuses to eat kibble 5/10",5,10,Dave,Not Specified
3307,699446877801091073,2016-02-16,"This is Archie. He's undercover in all these pics. Not actually a bee, cow, or Hawaiian. Sneaky af. 12/10",12,10,Archie,Not Specified
3308,699434518667751424,2016-02-16,I know this is a tad late but here's a wonderful Valentine's Day pupper 12/10,12,10,,Not Specified
3309,699423671849451520,2016-02-16,"""Don't ever talk to me or my son again."" ...both 10/10",10,10,,Not Specified
3310,699413908797464576,2016-02-16,"Meet Miley. She's a Scandinavian Hollabackgirl. Incalculably fluffy, unamused af. 11/10 would squeeze aggressively",11,10,Miley,Not Specified
3311,699370870310113280,2016-02-15,Say hello to Calbert. He doesn't have enough legs. Wtf Calbert. Still havin a blast tho. 11/10 would pet extra well,11,10,Calbert,Not Specified
3312,699323444782047232,2016-02-15,"""I'm bathing the children what do you want?""  ...both 10/10",10,10,,Not Specified
3313,699088579889332224,2016-02-15,This is Charl. He's a bully. Chucks that dumbbell around like its nothing. Sharp neck. Exceptionally unfluffy. 3/10,3,10,Charl,Not Specified
3314,699079609774645248,2016-02-15,Meet Reagan. He's a Persnicketus Derpson. Great with kids. Permanently caught off guard. 8/10,8,10,Reagan,Not Specified
3315,699072405256409088,2016-02-15,ERMAHGERD 12/10 please enjoy,12,10,,Not Specified
3316,699060279947165696,2016-02-15,This is Yukon. He pukes rainbows. 12/10 magical af,12,10,Yukon,Not Specified
3317,699036661657767936,2016-02-15,HAPPY V-DAY FROM YOUR FAV PUPPER SQUAD 13/10 for all,13,10,,Not Specified
3318,698989035503689728,2016-02-14,This is Oliver. He does toe touches in his sleep. 13/10 precious af,13,10,Oliver,Not Specified
3319,698953797952008193,2016-02-14,Meet CeCe. She wanted to take a selfie before her first day as a lumberjack. 11/10 crushing traditional gender roles,11,10,CeCe,Not Specified
3320,698907974262222848,2016-02-14,This dog is never sure if he's doing the right thing. 10/10,10,10,,Not Specified
3321,698710712454139905,2016-02-14,This is Cuddles. He's not entirely sure how doors work. 10/10 I believe in you Cuddles,10,10,Cuddles,Not Specified
3322,698703483621523456,2016-02-14,This is Rusty. He has no respect for POULTRY products. Unbelievable af. 7/10 would still pet,7,10,Rusty,Not Specified
3323,698635131305795584,2016-02-13,Here we are witnessing five Guatemalan Birch Floofs in their natural habitat. All 12/10 (Vid by @pootdanielle),12,10,,Not Specified
3324,698549713696649216,2016-02-13,This is Claude. He's trying to be seductive but he forgot to turn on the fireplace. 9/10 damn it Claude,9,10,Claude,Not Specified
3325,698355670425473025,2016-02-13,This is Jessiga. She's a Tasmanian McCringleberry. Selfies make her uncomfortable. 10/10 would pet in time of need,10,10,Jessiga,Not Specified
